{
 "$schema":"https://json-schema.org/draft/2020-12/schema","type":"object","additionalProperties":false,
 "required":["governs","artifactStatus","executionEnabled","version","levels","contract","fixtureRows"],
 "properties":{
  "$schema":{"type":"string"},"governs":{"const":"product_runtime"},"artifactStatus":{"const":"design_only"},"executionEnabled":{"const":false},"version":{"const":1},
  "levels":{"type":"array","minItems":3,"maxItems":3,"items":{"type":"object","additionalProperties":false,"required":["id","name","action","description","effect","maxProcesses","seconds","cooldownSeconds"],"properties":{"id":{"type":"integer","minimum":1,"maximum":3},"name":{"type":"string"},"action":{"type":"string"},"description":{"type":"string"},"effect":{"type":"string"},"maxProcesses":{"type":"integer","minimum":1},"seconds":{"type":"integer","minimum":1},"cooldownSeconds":{"type":"integer","minimum":1}}}},
  "contract":{"type":"object","additionalProperties":false,"required":["autoKill","autoEscalateCloseToForce","killTree","protectForeground","protectCriticalServices","requireFreshIdentity","productionAllowlistDefaultEmpty","maxConcurrentOperations"],"properties":{"autoKill":{"const":false},"autoEscalateCloseToForce":{"const":false},"killTree":{"const":false},"protectForeground":{"const":true},"protectCriticalServices":{"const":true},"requireFreshIdentity":{"const":true},"productionAllowlistDefaultEmpty":{"const":true},"maxConcurrentOperations":{"const":1}}},
  "fixtureRows":{"type":"array","items":{"type":"object","additionalProperties":false,"required":["id","name","pid","startKey","level","action","risk","ramMb","privateMb","cpu","estimatedMb","default","eligible","allowlisted","verifiedDisposable","effect","reason"],"properties":{"id":{"type":"string"},"name":{"type":"string"},"pid":{"type":"integer","minimum":1},"startKey":{"type":"string"},"level":{"type":"integer","minimum":1,"maximum":3},"action":{"enum":["trim","close","force","blocked"]},"risk":{"enum":["safe","review","danger","blocked"]},"ramMb":{"type":"number","minimum":0},"privateMb":{"type":"number","minimum":0},"cpu":{"type":"number","minimum":0,"maximum":100},"estimatedMb":{"type":"number","minimum":0},"default":{"type":"boolean"},"eligible":{"type":"boolean"},"allowlisted":{"type":"boolean"},"verifiedDisposable":{"type":"boolean"},"effect":{"type":"string"},"reason":{"type":"string"}}}}
 }
}
