{
  "$schema": "./memory-design.schema.json",
  "governs": "product_runtime",
  "artifactStatus": "design_only",
  "executionEnabled": false,
  "version": 1,
  "levels": [
    {"id":1,"name":"Tiêu chuẩn","action":"Trim nhẹ","description":"Chỉ giảm working set của process đủ điều kiện; giữ app và dữ liệu.","effect":"RAM có thể nạp lại; không bảo đảm giảm CPU hay commit.","maxProcesses":12,"seconds":30,"cooldownSeconds":60},
    {"id":2,"name":"Chuyên sâu","action":"Trim rộng hơn","description":"Mở rộng ứng viên theo policy Strong; bảo vệ foreground, hệ thống và app đang bận.","effect":"Có thể chậm lần dùng lại vì page faults; vẫn không đóng app.","maxProcesses":32,"seconds":60,"cooldownSeconds":120},
    {"id":3,"name":"Giải phóng tác vụ","action":"Trim + đóng có kiểm soát","description":"Đóng task đã xác minh và được duyệt; force kill chỉ chọn riêng, không tự nâng cấp.","effect":"Có thể ngừng âm thanh, thông báo, tải xuống hoặc mất dữ liệu chưa lưu nếu force kill.","maxProcesses":8,"seconds":60,"cooldownSeconds":120}
  ],
  "contract":{"autoKill":false,"autoEscalateCloseToForce":false,"killTree":false,"protectForeground":true,"protectCriticalServices":true,"requireFreshIdentity":true,"productionAllowlistDefaultEmpty":true,"maxConcurrentOperations":1},
  "fixtureRows":[
    {"id":"cacheworker","name":"ExampleCacheWorker · mẫu","pid":1101,"startKey":"fixture-start-a","level":1,"action":"trim","risk":"safe","ramMb":450,"privateMb":110,"cpu":0.05,"estimatedMb":280,"default":true,"eligible":true,"allowlisted":false,"verifiedDisposable":false,"effect":"Giữ task và cache logic; trang RAM có thể nạp lại. Không cam kết giảm CPU.","reason":"Identity/policy/owner xác minh; không foreground, service hay đang bận."},
    {"id":"idlehelper","name":"ExampleIdleHelper · mẫu","pid":1102,"startKey":"fixture-start-b","level":2,"action":"trim","risk":"safe","ramMb":260,"privateMb":180,"cpu":0.6,"estimatedMb":130,"default":true,"eligible":true,"allowlisted":false,"verifiedDisposable":false,"effect":"Giữ ứng dụng; lần dùng lại có thể phát sinh page faults.","reason":"Đủ Strong policy trong fixture, không thuộc nhóm bảo vệ."},
    {"id":"disposable","name":"ExampleDisposableTray · mẫu","pid":1103,"startKey":"fixture-start-c","level":3,"action":"close","risk":"safe","ramMb":140,"privateMb":96,"cpu":0.3,"estimatedMb":140,"default":true,"eligible":true,"allowlisted":true,"verifiedDisposable":true,"effect":"Dừng tray phụ chỉ lưu cache, có thể mở lại. Profile fixture đã duyệt; không chứa dữ liệu người dùng.","reason":"Vendor graceful exit + same user + không service/child đang dùng + profile disposable đã được duyệt."},
    {"id":"music","name":"ExampleMusicPlayer · mẫu","pid":1104,"startKey":"fixture-start-d","level":3,"action":"close","risk":"review","ramMb":420,"privateMb":300,"cpu":2.4,"estimatedMb":420,"default":false,"eligible":true,"allowlisted":true,"verifiedDisposable":false,"effect":"Dừng nhạc và thông báo của player; mở lại khi cần. Không tự force nếu app chưa chịu đóng.","reason":"Ứng viên user đã cho phép đóng; cần duyệt tác động của lượt này."},
    {"id":"saveprompt","name":"ExampleEditorBackground · mẫu","pid":1105,"startKey":"fixture-start-e","level":3,"action":"close","risk":"review","ramMb":680,"privateMb":540,"cpu":0.2,"estimatedMb":680,"default":false,"eligible":true,"allowlisted":true,"verifiedDisposable":false,"effect":"Fixture sẽ hiện yêu cầu lưu và từ chối thoát: giữ app, 0 MB gain; không tự force kill.","reason":"Close request có thể bị từ chối hoặc hiện save prompt; foreground/user data không thể suy ra từ CPU thấp."},
    {"id":"hung","name":"ExampleHungUtility · mẫu","pid":1106,"startKey":"fixture-start-f","level":3,"action":"force","risk":"danger","ramMb":560,"privateMb":470,"cpu":12,"estimatedMb":560,"default":false,"eligible":true,"allowlisted":true,"verifiedDisposable":false,"effect":"Force kill ngừng tức thì, có thể mất dữ liệu chưa lưu/giao dịch đang ghi. Không kill cây con.","reason":"Chọn force riêng theo identity đã duyệt; không mặc định vì task CPU cao hoặc không phản hồi."},
    {"id":"windows","name":"Windows critical / service · mẫu","pid":1107,"startKey":"fixture-start-g","level":1,"action":"blocked","risk":"blocked","ramMb":800,"privateMb":500,"cpu":1.8,"estimatedMb":0,"default":false,"eligible":false,"allowlisted":false,"verifiedDisposable":false,"effect":"Đóng có thể hỏng session/Windows; không có override bằng admin hay confirm.","reason":"Critical/service/security/session; bảo vệ theo identity và OS/service inventory."},
    {"id":"foreground","name":"Editor đang làm việc · mẫu","pid":1108,"startKey":"fixture-start-h","level":1,"action":"blocked","risk":"blocked","ramMb":1200,"privateMb":920,"cpu":8,"estimatedMb":0,"default":false,"eligible":false,"allowlisted":false,"verifiedDisposable":false,"effect":"Có tài liệu chưa lưu, foreground hoặc workflow đang chạy; giữ lại.","reason":"Foreground, dữ liệu chưa lưu chưa xác minh; không auto trim/close/kill."},
    {"id":"unknown","name":"node / terminal / sync chưa rõ · mẫu","pid":1109,"startKey":"fixture-start-i","level":1,"action":"blocked","risk":"blocked","ramMb":950,"privateMb":700,"cpu":7,"estimatedMb":0,"default":false,"eligible":false,"allowlisted":false,"verifiedDisposable":false,"effect":"Có thể là build, backend, database hoặc sync. Chưa biết owner/dependency thì không coi không cần thiết.","reason":"Tên process/CPU thấp không chứng minh task không quan trọng; unknown fail closed."}
  ]
}
